,source,target,imp_score_ov,imp_score_brca,source_full_name,target_full_name
2324,GO:0019953,GO:0044703,0.0016259170101384096,0.004096980125129476,sexual reproduction,multi-organism reproductive process
2325,GO:0000904,GO:0048468,-0.0002594630763270087,-0.004898552112172082,GO:0000904,cell development
2326,GO:0002064,GO:0048468,0.001895455191054602,0.002741112490218802,epithelial cell development,cell development
2327,GO:0014031,GO:0048468,0.002413646115870269,0.0029216853816996942,mesenchymal cell development,cell development
2328,GO:0048469,GO:0048468,0.00042354077388636723,0.002187855683425703,cell maturation,cell development
2329,GO:0048666,GO:0048468,-0.0042843786623108,0.008443157206024052,neuron development,cell development
2330,GO:0048864,GO:0048468,-0.0034580231122302947,-0.003266250340286988,stem cell development,cell development
2331,GO:0061515,GO:0048468,0.0012746138584740433,-0.0035697198048699145,myeloid cell development,cell development
2332,GO:0055013,GO:0048468,0.0018675661704084183,-0.004408886792045434,cardiac muscle cell development,cell development
2333,GO:0048747,GO:0048468,4.031964907485246e-05,-0.005464687640034733,muscle cell development,cell development
2334,GO:0065003,GO:0043933,-0.007072569663813854,0.011856858980069333,protein-containing complex assembly,protein-containing complex organization
2335,GO:0071824,GO:0043933,-0.002697482396448384,0.002068057772315732,protein-DNA complex organization,protein-containing complex organization
2336,GO:0043624,GO:0043933,-5.882912441489165e-05,-0.00250642808403665,protein-containing complex disassembly,protein-containing complex organization
2337,GO:1904886,GO:0043933,-0.0033261666021547794,0.0064735648027191145,beta-catenin destruction complex disassembly,protein-containing complex organization
2338,GO:0022618,GO:0043933,2.9470244728490783e-05,-0.0004160921616492275,protein-RNA complex assembly,protein-containing complex organization
2339,GO:0034369,GO:0043933,-0.00031059181988558996,0.0025324800533130065,plasma lipoprotein particle remodeling,protein-containing complex organization
2340,GO:0034377,GO:0043933,-5.3268200798427086e-05,0.0016953616751499989,plasma lipoprotein particle assembly,protein-containing complex organization
2341,GO:0001558,GO:0051128,0.0028348761115701113,0.01620473061949376,regulation of cell growth,regulation of cellular component organization
2342,GO:0022604,GO:0051128,0.004713390831956458,-0.008357800984150877,regulation of cell morphogenesis,regulation of cellular component organization
2343,GO:0033043,GO:0051128,-0.00038165313615656446,0.020264534965697658,regulation of organelle organization,regulation of cellular component organization
2344,GO:0043244,GO:0051128,-0.0022110527647661625,-0.0018501589514393721,regulation of protein-containing complex disassembly,regulation of cellular component organization
2345,GO:0043254,GO:0051128,0.0018780240094472167,0.0031218702802405154,regulation of protein-containing complex assembly,regulation of cellular component organization
2346,GO:0050807,GO:0051128,0.0036949050443465564,-0.003996582108419394,regulation of synapse organization,regulation of cellular component organization
2347,GO:0051129,GO:0051128,-0.0019717509227228313,-0.0023047876801144188,negative regulation of cellular component organization,regulation of cellular component organization
2348,GO:0051130,GO:0051128,-0.0010344458614516805,-0.033397546672148996,positive regulation of cellular component organization,regulation of cellular component organization
2349,GO:0060142,GO:0051128,-0.0008130970450377034,-0.005506837928390302,regulation of syncytium formation by plasma membrane fusion,regulation of cellular component organization
2350,GO:1903053,GO:0051128,0.0024556038320517905,-0.0027462104712403486,regulation of extracellular matrix organization,regulation of cellular component organization
2351,GO:0110053,GO:0051128,0.005547368185300591,-0.015272543146256262,regulation of actin filament organization,regulation of cellular component organization
2352,GO:1902904,GO:0051128,-0.002840457801931578,0.0007052006067678333,negative regulation of supramolecular fiber organization,regulation of cellular component organization
2353,GO:1902905,GO:0051128,-0.006649209637810961,0.0009517536419960217,positive regulation of supramolecular fiber organization,regulation of cellular component organization
2354,GO:0045806,GO:0051128,0.0011258333890536221,0.0024989765827782054,negative regulation of endocytosis,regulation of cellular component organization
2355,GO:0048259,GO:0051128,-0.0020466579441025356,0.006815244999311714,regulation of receptor-mediated endocytosis,regulation of cellular component organization
2356,GO:1901889,GO:0051128,0.0006082321650683327,0.0004358463309715215,negative regulation of cell junction assembly,regulation of cellular component organization
2357,GO:2000810,GO:0051128,-0.0021479695283941917,-0.0009483728036797914,regulation of bicellular tight junction assembly,regulation of cellular component organization
2358,GO:0051894,GO:0051128,0.0025305374451880668,0.01445036221986432,positive regulation of focal adhesion assembly,regulation of cellular component organization
2359,GO:0031345,GO:0051128,-0.002550819705630019,-0.000369550915713131,negative regulation of cell projection organization,regulation of cellular component organization
2360,GO:0120035,GO:0051128,0.002040375365116412,0.008911697087711412,regulation of plasma membrane bounded cell projection organization,regulation of cellular component organization
2361,GO:0006468,GO:0006464,0.0037605696426668673,-0.003212099834443876,protein phosphorylation,protein modification process
2362,GO:0006471,GO:0006464,-0.0016491365305219318,-0.0004879560024444696,GO:0006471,protein modification process
2363,GO:0006497,GO:0006464,6.0558747108032204e-05,0.00022539777751430927,protein lipidation,protein modification process
2364,GO:0008214,GO:0006464,0.0006031423229569898,0.0006671226724087761,protein dealkylation,protein modification process
2365,GO:0016570,GO:0006464,0.0008570644918667237,-0.0009782130322306532,histone modification,protein modification process
2366,GO:0018193,GO:0006464,-0.0014471384237803864,-0.012343627469526691,peptidyl-amino acid modification,protein modification process
2367,GO:0031365,GO:0006464,-0.0005388925615250353,-0.0006362522827701042,N-terminal protein amino acid modification,protein modification process
2368,GO:0035601,GO:0006464,-0.002970989224924849,-0.0016420584056834953,protein deacylation,protein modification process
2369,GO:0043543,GO:0006464,0.0032659672858117187,-0.0002680922793163161,protein acylation,protein modification process
2370,GO:0043687,GO:0006464,-5.3272216028025595e-05,0.002314864447211199,post-translational protein modification,protein modification process
2371,GO:0070647,GO:0006464,0.0003783178741771543,0.0035605981333043514,protein modification by small protein conjugation or removal,protein modification process
2372,GO:0031503,GO:0008104,0.0005473044540220406,0.00022997212418920197,protein-containing complex localization,protein localization
2373,GO:0034613,GO:0008104,-0.0016610151110279469,0.0022541099703875973,protein localization,protein localization
2374,GO:0035418,GO:0008104,0.00027809252546564037,5.7818214804027404e-05,protein localization to synapse,protein localization
2375,GO:0045185,GO:0008104,-0.002048957965413211,-0.002605437160479983,maintenance of protein location,protein localization
2376,GO:0015031,GO:0008104,0.0008169041906974651,0.003059673406274688,protein transport,protein localization
2377,GO:0072594,GO:0008104,-0.0007290615396462105,0.0017177582388608567,establishment of protein localization to organelle,protein localization
2378,GO:0090150,GO:0008104,0.0006974970761182673,9.947815082483374e-05,establishment of protein localization to membrane,protein localization
2379,GO:0006984,GO:0007165,0.0018473079355207258,-0.005883309751949677,ER-nucleus signaling pathway,signal transduction
2380,GO:0007166,GO:0007165,0.01129529026976231,-0.020278420745671526,cell surface receptor signaling pathway,signal transduction
2381,GO:0007186,GO:0007165,0.002590777763757298,-0.0005356389445455654,G protein-coupled receptor signaling pathway,signal transduction
2382,GO:0030522,GO:0007165,-0.004343109696237995,0.00420885105445952,intracellular receptor signaling pathway,signal transduction
2383,GO:0035556,GO:0007165,0.005161520450962491,0.011333748968727788,intracellular signal transduction,signal transduction
2384,GO:0060395,GO:0007165,0.0003929498118356119,-0.0005344307302257024,SMAD protein signal transduction,signal transduction
2385,GO:0097190,GO:0007165,-0.00015340570648870175,0.005243272227424893,apoptotic signaling pathway,signal transduction
2386,GO:1903831,GO:0007165,0.0015942452746105934,0.010271577719982977,signal transduction involved in cellular response to ammonium ion,signal transduction
2387,GO:0036498,GO:0007165,0.0007525697431489021,0.004103612163819142,IRE1-mediated unfolded protein response,signal transduction
2388,GO:0097192,GO:0007165,-0.00019954113899276878,0.0006754838517221469,extrinsic apoptotic signaling pathway in absence of ligand,signal transduction
2389,GO:0098664,GO:0007165,-0.00034964946209015797,-0.013702029947114098,G protein-coupled serotonin receptor signaling pathway,signal transduction
2390,GO:0000165,GO:0007165,0.002458252552987414,-0.0017632937989287766,MAPK cascade,signal transduction
2391,GO:0043401,GO:0007165,0.0028465451364391744,-0.0014717835277507504,steroid hormone mediated signaling pathway,signal transduction
2392,GO:0009615,GO:0051707,-0.0009483143213777673,-0.0012739889471569193,response to virus,response to other organism
2393,GO:0009617,GO:0051707,-0.00036045023196124297,0.006330606252512506,response to bacterium,response to other organism
2394,GO:0009620,GO:0051707,-0.00016368162140335273,0.0016216445324389128,response to fungus,response to other organism
2395,GO:0019730,GO:0051707,-3.36930426613082e-05,0.001223109658759403,antimicrobial humoral response,response to other organism
2396,GO:0098542,GO:0051707,-0.0030002235472664247,-0.0024126089855361823,defense response to other organism,response to other organism
2397,GO:0042832,GO:0051707,0.0005548295182814712,0.00047339584909094094,defense response to protozoan,response to other organism
2398,GO:0006873,GO:0055082,-0.005016700797619896,0.014503256431992302,intracellular monoatomic ion homeostasis,intracellular chemical homeostasis
2399,GO:0071333,GO:0055082,-0.0004979382870196775,3.9187005242644836e-05,cellular response to glucose stimulus,intracellular chemical homeostasis
2400,GO:0009887,GO:0009653,-0.001007950346833871,0.023378159884542716,animal organ morphogenesis,anatomical structure morphogenesis
2401,GO:0010171,GO:0009653,-0.00025729326296000313,0.01129380518419746,body morphogenesis,anatomical structure morphogenesis
2402,GO:0021587,GO:0009653,0.00030506002478957096,-0.002629006067344284,cerebellum morphogenesis,anatomical structure morphogenesis
2403,GO:0035107,GO:0009653,0.0002803260666606879,0.00039760393324416354,appendage morphogenesis,anatomical structure morphogenesis
2404,GO:0035239,GO:0009653,0.0028087967373467606,0.004860169360615005,tube morphogenesis,anatomical structure morphogenesis
2405,GO:0048598,GO:0009653,-0.00040735126130072875,-0.004791427418743581,embryonic morphogenesis,anatomical structure morphogenesis
2406,GO:0048646,GO:0009653,-0.00020420370207137702,0.0026481420746175925,anatomical structure formation involved in morphogenesis,anatomical structure morphogenesis
2407,GO:0048729,GO:0009653,4.7771697416913215e-05,0.003982847891721565,tissue morphogenesis,anatomical structure morphogenesis
2408,GO:0060042,GO:0009653,0.0004761406074844781,0.0001542499853267437,retina morphogenesis in camera-type eye,anatomical structure morphogenesis
2409,GO:0060325,GO:0009653,0.0009095567460661104,-0.009291053595281117,face morphogenesis,anatomical structure morphogenesis
2410,GO:0003148,GO:0009653,-0.0014316298261924582,-0.00028961942887142407,outflow tract septum morphogenesis,anatomical structure morphogenesis
2411,GO:0060412,GO:0009653,0.0005359225465236695,-0.006619499118027838,ventricular septum morphogenesis,anatomical structure morphogenesis
2412,GO:0061384,GO:0009653,-0.0016060184748055244,0.0031605228869717545,heart trabecula morphogenesis,anatomical structure morphogenesis
2413,GO:0003180,GO:0009653,-0.0005391913552472499,0.0003241488573137122,aortic valve morphogenesis,anatomical structure morphogenesis
2414,GO:0003181,GO:0009653,-0.0019003263273770674,-0.001695207168545004,atrioventricular valve morphogenesis,anatomical structure morphogenesis
2415,GO:0009968,GO:0023057,-0.006595502487362068,0.016295824938278164,negative regulation of signal transduction,negative regulation of signaling
2416,GO:0046888,GO:0023057,0.0010837239974708628,-0.002279730157940425,negative regulation of hormone secretion,negative regulation of signaling
2417,GO:0050805,GO:0023057,0.0012578912154704905,-0.0017044803293939119,negative regulation of synaptic transmission,negative regulation of signaling
2418,GO:0010810,GO:0030155,5.300164691113959e-05,-0.0015827801438869009,regulation of cell-substrate adhesion,regulation of cell adhesion
2419,GO:0033628,GO:0030155,-0.00021295372650001403,0.0004919492426660224,regulation of cell adhesion mediated by integrin,regulation of cell adhesion
2420,GO:0045785,GO:0030155,0.0005864390676969918,0.004079093810422223,positive regulation of cell adhesion,regulation of cell adhesion
2421,GO:0022408,GO:0030155,-0.0017756506990447487,-0.00703302041300562,negative regulation of cell-cell adhesion,regulation of cell adhesion
2422,GO:0022409,GO:0030155,-0.0010486514732879295,-0.002435924953931941,positive regulation of cell-cell adhesion,regulation of cell adhesion
2423,GO:0034110,GO:0030155,0.00019006459731096958,0.0009310321821738682,regulation of homotypic cell-cell adhesion,regulation of cell adhesion
2424,GO:0034114,GO:0030155,-9.644700668948629e-05,-0.0014142909444269192,regulation of heterotypic cell-cell adhesion,regulation of cell adhesion
2425,GO:1903037,GO:0030155,0.0014099029420272238,-0.001536359715817171,regulation of leukocyte cell-cell adhesion,regulation of cell adhesion
2426,GO:0042060,GO:0009611,4.2845663628342614e-05,0.005145183633097222,wound healing,response to wounding
2427,GO:0031103,GO:0009611,0.000410666500497369,0.0005016000068742458,axon regeneration,response to wounding
2428,GO:0002244,GO:0030097,0.0012193080716847177,-0.0013039065514469975,hematopoietic progenitor cell differentiation,hemopoiesis
2429,GO:0002521,GO:0030097,0.0008941356549875066,-0.014744468092653864,leukocyte differentiation,hemopoiesis
2430,GO:0030099,GO:0030097,-0.002156314557227987,0.017104811826994044,myeloid cell differentiation,hemopoiesis
2431,GO:0035162,GO:0030097,0.00043788334472667784,-0.004582627576267593,embryonic hemopoiesis,hemopoiesis
2432,GO:0002830,GO:0050778,0.0002488270020601976,0.003010185109678797,positive regulation of type 2 immune response,positive regulation of immune response
2433,GO:0002922,GO:0050778,-0.0003225816999182419,0.003147968659150875,positive regulation of humoral immune response,positive regulation of immune response
2434,GO:0045624,GO:0050778,-3.280723071443121e-05,-0.006122995973579133,positive regulation of T-helper cell differentiation,positive regulation of immune response
2435,GO:0050857,GO:0050778,-0.001563483577242862,-0.0002224536056658269,positive regulation of antigen receptor-mediated signaling pathway,positive regulation of immune response
2436,GO:0002726,GO:0050778,0.0007268489473005574,0.0009104303057186638,positive regulation of T cell cytokine production,positive regulation of immune response
2437,GO:0034123,GO:0050778,-0.0018818845373663796,0.004663936109414116,positive regulation of toll-like receptor signaling pathway,positive regulation of immune response
2438,GO:0002757,GO:0050778,-0.0011794995266875097,0.003661475704051199,immune response-activating signaling pathway,positive regulation of immune response
2439,GO:0002758,GO:0050778,0.0003862389785231673,-0.0036712647831294246,innate immune response-activating signaling pathway,positive regulation of immune response
2440,GO:0002274,GO:0045321,-0.0007895980837500682,0.002394171055287512,myeloid leukocyte activation,leukocyte activation
2441,GO:0002366,GO:0045321,-0.0022142326751420265,0.006380785133114166,leukocyte activation involved in immune response,leukocyte activation
2442,GO:0046649,GO:0045321,-0.0006237270252583014,0.004568042581603811,lymphocyte activation,leukocyte activation
2443,GO:0006355,GO:0010468,0.0026106894921265264,0.01148127863367474,regulation of DNA-templated transcription,regulation of gene expression
2444,GO:0010608,GO:0010468,-0.002993025379595194,-0.0050597194293228375,post-transcriptional regulation of gene expression,regulation of gene expression
2445,GO:0010628,GO:0010468,0.0033064303166518254,-0.008491687867420312,positive regulation of gene expression,regulation of gene expression
2446,GO:0010629,GO:0010468,0.0029445821429558154,-0.011154309703758799,negative regulation of gene expression,regulation of gene expression
2447,GO:0032922,GO:0010468,-0.0007493342466573823,-0.0001002607750330027,circadian regulation of gene expression,regulation of gene expression
2448,GO:0040029,GO:0010468,-0.0011361846473999324,-0.0020139433365745033,epigenetic regulation of gene expression,regulation of gene expression
2449,GO:0043484,GO:0010468,-0.0006505401831063284,-0.005514428551658395,regulation of RNA splicing,regulation of gene expression
2450,GO:0050684,GO:0010468,0.0021307620608129055,0.006580279370881939,regulation of mRNA processing,regulation of gene expression
2451,GO:0070613,GO:0010468,0.00018329722000863727,-0.0031077199485598844,regulation of protein processing,regulation of gene expression
2452,GO:0043488,GO:0010468,-0.00042219294101231885,-0.005065495513135914,regulation of mRNA stability,regulation of gene expression
2453,GO:0045596,GO:0051093,-0.00039214670429315413,0.0005578470065361744,negative regulation of cell differentiation,negative regulation of developmental process
2454,GO:0051961,GO:0051093,-0.0036259180678838727,-0.002586061082554028,negative regulation of nervous system development,negative regulation of developmental process
2455,GO:0070168,GO:0051093,-0.000697708196532839,0.0017434813485373436,negative regulation of biomineral tissue development,negative regulation of developmental process
2456,GO:0090344,GO:0051093,0.0015299337911831208,0.00038753430323237707,GO:0090344,negative regulation of developmental process
2457,GO:0110111,GO:0051093,0.0006658132050839467,-0.005901568432728859,negative regulation of animal organ morphogenesis,negative regulation of developmental process
2458,GO:1903707,GO:0051093,0.0013689268313699702,0.0015038132803393443,negative regulation of hemopoiesis,negative regulation of developmental process
2459,GO:0055022,GO:0051093,-0.0001004474620842569,0.0008658181407058441,negative regulation of cardiac muscle tissue growth,negative regulation of developmental process
2460,GO:0040019,GO:0051094,0.0001084333543911387,0.0005122412168659633,positive regulation of embryonic development,positive regulation of developmental process
2461,GO:0045597,GO:0051094,0.0022981123971256095,-0.005158333061121452,positive regulation of cell differentiation,positive regulation of developmental process
2462,GO:0045830,GO:0051094,-0.00042942071803251026,0.0014292850479059882,positive regulation of isotype switching,positive regulation of developmental process
2463,GO:0048639,GO:0051094,0.0001615129012863766,0.0009418921115366817,positive regulation of developmental growth,positive regulation of developmental process
2464,GO:0061036,GO:0051094,8.80299619371478e-05,0.0014482391167863489,positive regulation of cartilage development,positive regulation of developmental process
2465,GO:0090184,GO:0051094,-0.0005949217120268073,-0.0027935305648191747,positive regulation of kidney development,positive regulation of developmental process
2466,GO:0110110,GO:0051094,0.001410333495900785,0.001410925431240939,positive regulation of animal organ morphogenesis,positive regulation of developmental process
2467,GO:1905332,GO:0051094,0.0006511410623285747,-0.003033557842982683,positive regulation of morphogenesis of an epithelium,positive regulation of developmental process
2468,GO:0050769,GO:0051094,-0.0005494428661725125,0.0014057662151723644,positive regulation of neurogenesis,positive regulation of developmental process
2469,GO:0051965,GO:0051094,-0.00041151909554004056,0.001394628249459446,positive regulation of synapse assembly,positive regulation of developmental process
2470,GO:0030501,GO:0051094,0.00039111287081361343,0.0026608279803760388,positive regulation of bone mineralization,positive regulation of developmental process
2471,GO:0045639,GO:0051094,-0.000846553207136615,-0.0034151447392306816,positive regulation of myeloid cell differentiation,positive regulation of developmental process
2472,GO:0045844,GO:0051094,-0.0005657303681189117,-0.0012000865877608968,positive regulation of striated muscle tissue development,positive regulation of developmental process
2473,GO:0045766,GO:0051094,6.381317051601448e-05,0.0050267226290336125,positive regulation of angiogenesis,positive regulation of developmental process
2474,GO:0009968,GO:0048585,-0.0008130129692215481,0.007583369475280232,negative regulation of signal transduction,negative regulation of response to stimulus
2475,GO:0032102,GO:0048585,-0.0009410905004803417,-0.001344859368778804,negative regulation of response to external stimulus,negative regulation of response to stimulus
2476,GO:0050777,GO:0048585,-0.0015982892509159609,-0.0006645039786280113,negative regulation of immune response,negative regulation of response to stimulus
2477,GO:1903035,GO:0048585,-3.723295037151442e-05,-0.0008860862971205938,negative regulation of response to wounding,negative regulation of response to stimulus
2478,GO:2001024,GO:0048585,-0.0009405558228774317,-0.0013503271211379143,negative regulation of response to drug,negative regulation of response to stimulus
2479,GO:0030514,GO:0048585,7.606174215732173e-05,0.0034471446705639833,negative regulation of BMP signaling pathway,negative regulation of response to stimulus
2480,GO:0046627,GO:0048585,0.0010583202148157324,0.0005571373005473021,negative regulation of insulin receptor signaling pathway,negative regulation of response to stimulus
2481,GO:1902230,GO:0048585,0.0004659606866181537,-0.0007536344943966691,negative regulation of intrinsic apoptotic signaling pathway in response to DNA damage,negative regulation of response to stimulus
2482,GO:0007498,GO:0009888,-0.00010363750541183032,7.906587249779397e-05,mesoderm development,tissue development
2483,GO:0046697,GO:0009888,0.00047693275347850827,-0.003671712596428984,decidualization,tissue development
2484,GO:0048729,GO:0009888,5.337856983640073e-05,0.007118406407273475,tissue morphogenesis,tissue development
2485,GO:0060429,GO:0009888,-0.004958722859356088,-0.004976163026935005,epithelium development,tissue development
2486,GO:0060485,GO:0009888,-0.0010666084468466245,0.003138403069393043,mesenchyme development,tissue development
2487,GO:0060612,GO:0009888,-0.00041389554548498347,0.004554664469856866,adipose tissue development,tissue development
2488,GO:0030282,GO:0009888,-0.0007055581227190138,-0.0012931603607891319,bone mineralization,tissue development
2489,GO:0009913,GO:0009888,-0.00018165620449622774,0.0011643459130206933,epidermal cell differentiation,tissue development
2490,GO:0048730,GO:0009888,0.00023688430214430367,0.0021171327668867046,epidermis morphogenesis,tissue development
2491,GO:0035987,GO:0009888,0.00013941458950582404,-0.0002660228587556351,endodermal cell differentiation,tissue development
2492,GO:0014706,GO:0009888,-0.0003536724674754487,-0.002938318842517965,striated muscle tissue development,tissue development
2493,GO:0003014,GO:0003008,0.0021431015913861403,-0.008454185352177531,renal system process,system process
2494,GO:0007588,GO:0003008,-0.0007129097744013666,0.0030915812988443845,excretion,system process
2495,GO:0050877,GO:0003008,-0.0015512648723259338,0.0008709941273121104,nervous system process,system process
2496,GO:0050892,GO:0003008,-0.0004864037953890423,0.003622874825692229,intestinal absorption,system process
2497,GO:0006936,GO:0003008,-0.0009367253863122523,-0.003245084548706362,muscle contraction,system process
2498,GO:0043500,GO:0003008,-0.0006699025787143245,-0.0012676801994806605,muscle adaptation,system process
2499,GO:0090075,GO:0003008,-0.0006875726452350963,0.00031003126908838666,relaxation of muscle,system process
2500,GO:0003015,GO:0003008,0.0016886513873403367,-0.006129978515350366,heart process,system process
2501,GO:0008015,GO:0003008,-0.0008545022601259754,0.008518326680907413,blood circulation,system process
2502,GO:0043114,GO:0003008,-0.00039625851727994655,-0.0037056799246754637,regulation of vascular permeability,system process
2503,GO:0003300,GO:0003008,-0.0004549992963009088,-0.00023921587101272235,cardiac muscle hypertrophy,system process
2504,GO:0002003,GO:0003008,0.00017847713485030062,0.0004949513514656324,angiotensin maturation,system process
2505,GO:0006873,GO:0050801,0.00034445056306963307,-0.0009322152642839671,intracellular monoatomic ion homeostasis,monoatomic ion homeostasis
2506,GO:0055080,GO:0050801,0.0036289027354929853,-0.003375075008445473,monoatomic cation homeostasis,monoatomic ion homeostasis
2507,GO:0098771,GO:0050801,0.0004212893840606282,-0.001385483875398015,inorganic ion homeostasis,monoatomic ion homeostasis
2508,GO:0055083,GO:0050801,0.00032661230269182614,-0.0012910564915073045,GO:0055083,monoatomic ion homeostasis
2509,GO:0055089,GO:0050801,0.0005280498568871631,-0.0016224032328678172,fatty acid homeostasis,monoatomic ion homeostasis
2510,GO:0014048,GO:1903530,-0.0006273543179161496,0.0018644076957188462,regulation of glutamate secretion,regulation of secretion by cell
